{
  "schema": "parcel_forge.repair_proposal/2",
  "changes": [
    {
      "path": "/geometry/fault",
      "from": "missing_bottom",
      "to": "none"
    }
  ],
  "source_run": "20260917T012420Z_s2_open_box_no_bottom",
  "source_spec_sha256": "aed2aeb5d3423d1c65360d572c798975b9f3baa2faa2f86bdd6e726c6b0a9934",
  "attempt": 1
}
